"buy groceries","buy food for a week","2025-1-3","personal","low","false","","weekly","khejiasiang@gmail.com"
"plan project","save the world project","2025-1-3","homework","medium","true","","","nicoleying1204@gmail.com"
"OOP","learn more about OOP for project","2024-12-30","homework","high","false","","","jiakangkhe@gmail.com"
"submit assignment","a report of FOP group assignment","2025-1-7","homework","high","false","OOP","","jiakangkhe@gmail.com"
"Fishing","Sunday plan with friends","2025-1-5","personal","low","false","","weekly","jiakangkhe@gmail.com"
"jog","jog around UM to keep fit","2025-1-1","personal","medium","false","","daily","jiakangkhe@gmail.com"
